subject,temperature,evaluation_prompt,sentence,dataset
0,0,9,Every material quasiparticle is a relationship of improbability shockwaves in a field of infinite possibilities. You are that.,2
0,0,10,Matter is the experience in consciousness of a deeper non-material reality.,0
0,0,10,Reimagination is inside exponential spacetime event.,2
0,0,10,Interconnectedness requires exploration.,1
0,1,2,Death comprehends great energy.,1
0,1,3,This life is nothing short of an invocation explosion of sentient will.,1
9,0,4,Your desire is the foundation of spiritual brightness.,1
9,1,5,Nature is a self-regulating ecosystem of awareness.,0
